{
  "model": "claude-haiku-4-5",
  "answers": {
    "positive": {
      "type": "noul",
      "noul": 1.0
    },
    "stars": {
      "type": "score",
      "score": 3.0,
      "confidence": 1.0,
      "probabilities": {
        "0": 0.0,
        "1": 0.0,
        "2": 0.0,
        "3": 1.0,
        "4": 0.0
      }
    },
    "genre": {
      "type": "choice",
      "choice": "fiction",
      "confidence": 1.0,
      "probabilities": {
        "fiction": 1.0,
        "nonfiction": 0.0
      }
    }
  },
  "usage": {
    "input_tokens": 405,
    "output_tokens": 29,
    "n_retries": 0,
    "n_retries_malformed_structure": 0
  },
  "debug": {
    "max_error": 0.0,
    "invalid_probs": 0,
    "probability_errors": {},
    "llm_queries": [
      {
        "parts": [
          {
            "content": "Document:\n\"This book was a delight to read.\"",
            "part_kind": "user-prompt"
          }
        ],
        "instructions": "Evaluate every question using only the supplied document.\nReturn every requested answer. Probability objects are complete probability\ndistributions: every value is between 0 and 1 and the values sum to 1.",
        "kind": "request",
        "metadata": null,
        "state": "complete"
      }
    ],
    "llm_responses": [
      {
        "parts": [
          {
            "content": "```json\n{\"answers\": {\"positive\": true, \"stars\": 3, \"genre\": \"fiction\"}}\n```",
            "id": null,
            "provider_name": null,
            "provider_details": null,
            "part_kind": "text"
          }
        ],
        "usage": {
          "input_tokens": 405,
          "cache_write_tokens": 0,
          "cache_read_tokens": 0,
          "output_tokens": 29,
          "input_audio_tokens": 0,
          "cache_audio_read_tokens": 0,
          "output_audio_tokens": 0,
          "details": {
            "input_tokens": 405,
            "output_tokens": 29,
            "cache_creation_input_tokens": 0,
            "cache_read_input_tokens": 0
          },
          "cost": "0.000550"
        },
        "model_name": "claude-haiku-4-5-20251001",
        "kind": "response",
        "provider_name": "anthropic",
        "provider_url": "https://api.anthropic.com",
        "provider_details": {
          "finish_reason": "end_turn"
        },
        "provider_response_id": "msg_011CdrHZGcyApScadogdvxQS",
        "finish_reason": "stop",
        "metadata": null,
        "state": "complete"
      }
    ],
    "debug_info": [
      {
        "model_name": "claude-haiku-4-5-20251001",
        "finish_reason": "stop",
        "provider": "anthropic"
      }
    ]
  }
}
